{
  "$schema": "https://json-schema.org/draft/2020-12/schema",
  "$id": "https://nauticana.github.io/charter/schema/evidence/evidence_record.schema.json",
  "title": "EvidenceRecord",
  "description": "One categorized record; corrections supersede rather than replace.",
  "x-charter-requirements": [
    "CHR-EVID-003",
    "CHR-EVID-004",
    "CHR-EVID-005",
    "CHR-EVID-011",
    "CHR-EVID-013",
    "CHR-EVID-014",
    "CHR-EVID-015",
    "CHR-INFO-004"
  ],
  "type": "object",
  "allOf": [
    {
      "$ref": "../common.schema.json#/$defs/documentBase"
    },
    {
      "if": {
        "required": [
          "assessment"
        ]
      },
      "then": {
        "if": {
          "properties": {
            "assessment": {
              "properties": {
                "judge": {
                  "properties": {
                    "kind": {
                      "const": "HumanIdentity"
                    }
                  }
                }
              }
            }
          }
        },
        "then": {
          "properties": {
            "category": {
              "const": "human-decision"
            }
          }
        },
        "else": {
          "properties": {
            "category": {
              "enum": [
                "agent-assertion",
                "derived-conclusion"
              ]
            }
          }
        }
      }
    }
  ],
  "properties": {
    "charterSpecVersion": true,
    "namespace": true,
    "id": true,
    "name": true,
    "description": true,
    "lifecycleState": true,
    "validity": true,
    "extensions": true,
    "derivedFrom": true,
    "kind": {
      "const": "EvidenceRecord"
    },
    "enterpriseId": {
      "$ref": "../common.schema.json#/$defs/idRef",
      "x-charter-ref-kinds": [
        "Enterprise"
      ]
    },
    "category": {
      "type": "string",
      "enum": [
        "observed-fact",
        "agent-assertion",
        "human-decision",
        "external-response",
        "derived-conclusion"
      ]
    },
    "content": {
      "type": "string",
      "minLength": 1,
      "maxLength": 2000
    },
    "recordedAt": {
      "type": "string",
      "format": "date-time"
    },
    "sources": {
      "type": "array",
      "minItems": 1,
      "items": {
        "type": "string",
        "minLength": 1,
        "maxLength": 500
      },
      "description": "Provenance references for material sources and transformations."
    },
    "transformations": {
      "type": "array",
      "minItems": 1,
      "items": {
        "type": "string",
        "minLength": 1,
        "maxLength": 1000
      }
    },
    "supersedes": {
      "$ref": "../common.schema.json#/$defs/idRef",
      "x-charter-ref-kinds": [
        "EvidenceRecord"
      ]
    },
    "integrity": {
      "$ref": "../common.schema.json#/$defs/integrity",
      "description": "Digest of the content member, so one immutable record is verifiable outside a bundle."
    },
    "assessment": {
      "description": "An evaluation that justified releasing a definition, or feedback on an outcome (CHR-EVID-013).",
      "type": "object",
      "properties": {
        "assessmentKind": {
          "enum": [
            "evaluation",
            "feedback"
          ]
        },
        "subject": {
          "description": "The AgentDefinition evaluated or the ActionRecord rated.",
          "allOf": [
            {
              "$ref": "../common.schema.json#/$defs/objectRef"
            }
          ]
        },
        "subjectDigest": {
          "type": "string",
          "minLength": 1,
          "maxLength": 500
        },
        "judge": {
          "description": "The human, agent, or external evaluator that judged.",
          "allOf": [
            {
              "$ref": "../common.schema.json#/$defs/objectRef"
            }
          ]
        },
        "judgeVersion": {
          "type": "string",
          "minLength": 1,
          "maxLength": 60
        },
        "caseSet": {
          "type": "object",
          "properties": {
            "id": {
              "$ref": "../common.schema.json#/$defs/identifier"
            },
            "version": {
              "type": "string",
              "minLength": 1,
              "maxLength": 60
            }
          },
          "required": [
            "id",
            "version"
          ],
          "additionalProperties": false
        },
        "scores": {
          "type": "array",
          "minItems": 1,
          "items": {
            "type": "object",
            "properties": {
              "metric": {
                "$ref": "../common.schema.json#/$defs/identifier"
              },
              "value": {
                "type": "number"
              }
            },
            "required": [
              "metric",
              "value"
            ],
            "additionalProperties": false
          }
        },
        "rating": {
          "type": "string",
          "minLength": 1,
          "maxLength": 60
        },
        "reason": {
          "type": "string",
          "minLength": 1,
          "maxLength": 500
        }
      },
      "required": [
        "assessmentKind",
        "subject",
        "judge"
      ],
      "additionalProperties": false,
      "allOf": [
        {
          "if": {
            "properties": {
              "assessmentKind": {
                "const": "evaluation"
              }
            }
          },
          "then": {
            "required": [
              "subjectDigest",
              "caseSet",
              "scores"
            ]
          }
        },
        {
          "if": {
            "properties": {
              "assessmentKind": {
                "const": "feedback"
              }
            }
          },
          "then": {
            "required": [
              "rating",
              "reason"
            ]
          }
        }
      ]
    },
    "fact": {
      "description": "The value of one attribute of a subject at a time, as this record's source states it (CHR-EVID-014).",
      "type": "object",
      "properties": {
        "subject": {
          "description": "The business object the fact is about.",
          "allOf": [
            {
              "$ref": "../common.schema.json#/$defs/objectRef"
            }
          ]
        },
        "informationId": {
          "$ref": "../common.schema.json#/$defs/idRef",
          "x-charter-ref-kinds": [
            "InformationDefinition"
          ]
        },
        "attribute": {
          "type": "string",
          "minLength": 1,
          "maxLength": 120
        },
        "value": {
          "description": "The stated value of the attribute."
        },
        "validAt": {
          "description": "When the value held in the source.",
          "type": "string",
          "format": "date-time"
        },
        "systemProfileId": {
          "$ref": "../common.schema.json#/$defs/idRef",
          "x-charter-ref-kinds": [
            "SystemProfile"
          ]
        }
      },
      "required": [
        "subject",
        "informationId",
        "attribute",
        "value",
        "validAt"
      ],
      "additionalProperties": false
    }
  },
  "required": [
    "kind",
    "enterpriseId",
    "category",
    "content",
    "recordedAt"
  ],
  "unevaluatedProperties": false,
  "if": {
    "properties": {
      "category": {
        "const": "derived-conclusion"
      }
    },
    "required": [
      "category"
    ]
  },
  "then": {
    "required": [
      "sources",
      "transformations"
    ]
  }
}
