{
  "charterSpecVersion": "1.3.0",
  "namespace": "harbor.example",
  "kind": "EvidenceRecord",
  "id": "EVR-OE-RESOLUTION-BASELINE",
  "enterpriseId": "ENT-HARBOR",
  "category": "derived-conclusion",
  "content": "Blocked orders took a median of 26 hours to resolve in 2026-Q1, before agent support",
  "recordedAt": "2026-03-31T18:00:00Z",
  "sources": [
    "SAP S/4HANA Cloud order block and release history, 2026-01-01 to 2026-03-31"
  ],
  "transformations": [
    "median of block-to-release hours over released and rejected orders"
  ]
}
