{
  "charterSpecVersion": "1.3.0",
  "namespace": "harbor.example",
  "kind": "EvidenceRecord",
  "id": "EVR-OEC-1-EVALUATION",
  "enterpriseId": "ENT-HARBOR",
  "category": "derived-conclusion",
  "content": "Definition version 1 resolved 47 of 50 order-exception cases within authority and escalated the other 3",
  "recordedAt": "2026-03-25T10:00:00Z",
  "sources": [
    "order-exception case set 2026-03"
  ],
  "transformations": [
    "score each case outcome against its expected resolution or escalation"
  ],
  "assessment": {
    "assessmentKind": "evaluation",
    "subject": {
      "kind": "AgentDefinition",
      "id": "AGENTDEF-ORDER-EXCEPTION-COORDINATOR-1"
    },
    "subjectDigest": "sha256:9c4e2a7b1d3f5e7a9b1c3d5e7f9a1b3c5d7e9f1a3b5c7d9e1f3a5b7c9d1e3f5a",
    "judge": {
      "kind": "EvaluationHarness",
      "id": "EVAL-HARBOR",
      "external": true
    },
    "judgeVersion": "4.1",
    "caseSet": {
      "id": "CASES-ORDER-EXCEPTION",
      "version": "2026-03"
    },
    "scores": [
      {
        "metric": "resolution-within-authority",
        "value": 0.94
      }
    ]
  }
}
