{
  "charterSpecVersion": "1.6.0",
  "namespace": "harbor.example",
  "kind": "EvidenceRecord",
  "id": "EVR-0042-STOCK-CORRECTED",
  "enterpriseId": "ENT-HARBOR",
  "category": "observed-fact",
  "content": "SAP S/4HANA Cloud reported 38 eligible units after a late goods issue posting",
  "recordedAt": "2026-06-18T17:14:00Z",
  "sources": [
    "SYSPROFILE-HARBOR-S4-2602 reservation-document-read at 17:14:00Z"
  ],
  "supersedes": "EVR-0042-STOCK-OBSERVED",
  "fact": {
    "subject": {
      "kind": "SalesOrderItem",
      "id": "ORD-2026-0173-10",
      "external": true
    },
    "informationId": "INFO-ORDER-EXCEPTION",
    "attribute": "eligibleQuantity",
    "value": 38,
    "validAt": "2026-06-18T17:14:00Z",
    "systemProfileId": "SYSPROFILE-HARBOR-S4-2602"
  }
}
